{
  "$schema": "https://json-schema.org/draft/2020-12/schema",
  "$id": "https://github.com/dimensionalOS/dimos/blob/main/experimental/gateway/annotations.schema.json",
  "title": "dimos robots",
  "description": "experimental/gateway/annotations.json (generated) and robots.source.json (hand-written): every robot dimos supports, the directories its code lives in, and what each of its blueprints is for, with the settings to decide before running it.",
  "type": "object",
  "additionalProperties": false,
  "required": [
    "robots",
    "excluded",
    "types"
  ],
  "properties": {
    "$schema": {
      "type": "string"
    },
    "about": {
      "type": "string"
    },
    "types": {
      "description": "The robot types, in the order a launcher groups robots by: each robot's `type` is one of these keys (or null: not a robot dimos drives, shown last under Other).",
      "type": "object",
      "minProperties": 1,
      "propertyNames": {
        "pattern": "^[a-z][a-z0-9_]*$"
      },
      "additionalProperties": {
        "type": "object",
        "additionalProperties": false,
        "required": [
          "label"
        ],
        "properties": {
          "label": {
            "description": "the group's heading, e.g. Dogs",
            "type": "string",
            "minLength": 1
          }
        }
      }
    },
    "robots": {
      "description": "Every robot, in display order, by id.",
      "type": "object",
      "propertyNames": {
        "pattern": "^[a-z][a-z0-9_-]*$"
      },
      "additionalProperties": {
        "$ref": "#/$defs/robot"
      }
    },
    "excluded": {
      "description": "Directories under dimos/robot that are not robots, each with the reason.",
      "type": "object",
      "propertyNames": {
        "pattern": "^dimos/robot/"
      },
      "additionalProperties": {
        "type": "string",
        "minLength": 1
      }
    },
    "global_config": {
      "description": "annotations.yaml only, generated: every GlobalConfig field with its type, default, choices and description, read from GlobalConfig (annotations.json's settings take theirs from it).",
      "type": "object",
      "additionalProperties": {
        "type": "object"
      }
    }
  },
  "$defs": {
    "robot": {
      "type": "object",
      "additionalProperties": false,
      "required": [
        "name",
        "description",
        "type",
        "manufacturer",
        "dirs",
        "blueprints"
      ],
      "properties": {
        "name": {
          "type": "string",
          "minLength": 1
        },
        "description": {
          "type": "string",
          "minLength": 1
        },
        "type": {
          "description": "What kind of robot it is: a key of the top-level `types` (dog, humanoid, wheeled, arm, drone), or null when it isn't a robot dimos drives (sensors, demos, simulators, coordinators). A launcher groups robots by it; Desktop's robot picker shows only the robots with a type.",
          "type": [
            "string",
            "null"
          ],
          "minLength": 1
        },
        "manufacturer": {
          "description": "Who makes it, as its `name` starts (\"Unitree\" for \"Unitree Go2\"); null for DIY, open-source and generic hardware, and for what isn't a robot. Robots in one vendor folder (dimos/robot/<vendor>/<robot>) share it.",
          "type": [
            "string",
            "null"
          ],
          "minLength": 1
        },
        "dirs": {
          "description": "The code directories that are this robot's (repo-relative). Every blueprint defined under one must be listed here.",
          "type": "array",
          "items": {
            "type": "string",
            "pattern": "^dimos/[A-Za-z0-9_/]+$"
          }
        },
        "recommended": {
          "description": "The blueprints to suggest first for this robot, best first (a launcher lists them on top). Each is one of this robot's `blueprints`.",
          "type": "array",
          "uniqueItems": true,
          "items": {
            "type": "string",
            "minLength": 1
          }
        },
        "defaults": {
          "description": "What a blueprint of this robot has unless it says otherwise.",
          "type": "object",
          "additionalProperties": false,
          "properties": {
            "recommended_config": {
              "$ref": "#/$defs/recommended_config"
            }
          }
        },
        "blueprints": {
          "description": "This robot's blueprints, by registered name (dimos/robot/all_blueprints.py).",
          "type": "object",
          "additionalProperties": {
            "$ref": "#/$defs/blueprint"
          }
        }
      }
    },
    "blueprint": {
      "type": "object",
      "additionalProperties": false,
      "required": [
        "title",
        "description"
      ],
      "properties": {
        "title": {
          "type": "string",
          "minLength": 1
        },
        "description": {
          "description": "one plain sentence or two: what it does and what it needs",
          "type": "string",
          "minLength": 1
        },
        "starter": {
          "description": "a pick for \"start here\": its rank (1 first) across every robot",
          "type": "integer",
          "minimum": 1
        },
        "hidden": {
          "description": "a test, benchmark, mock or building block: listed only when asked for",
          "type": "boolean"
        },
        "recommended_config": {
          "$ref": "#/$defs/recommended_config"
        }
      }
    },
    "recommended_config": {
      "description": "The settings a person should decide before running it, in order (a launcher shows them with its Launch button, and a config editor puts them on top). Each names a config value (a GlobalConfig field `global`, or a module config field `module` + `field`), or is a pick of several values at once (a `label` and `choices` that each `set` some of them, e.g. Robot / Replay / Simulator). Any entry can have `choices` (an enum: segmented buttons for up to 4, else a select) and `when` (shown only while those config values hold). On a blueprint it replaces the robot's defaults' list; [] means none.",
      "type": "array",
      "items": {
        "$ref": "#/$defs/recommended_setting"
      }
    },
    "recommended_setting": {
      "type": "object",
      "additionalProperties": false,
      "oneOf": [
        {
          "required": [
            "global"
          ],
          "not": {
            "anyOf": [
              {
                "required": [
                  "module"
                ]
              },
              {
                "required": [
                  "field"
                ]
              }
            ]
          }
        },
        {
          "required": [
            "module",
            "field"
          ],
          "not": {
            "required": [
              "global"
            ]
          }
        },
        {
          "required": [
            "label",
            "choices"
          ],
          "not": {
            "anyOf": [
              {
                "required": [
                  "global"
                ]
              },
              {
                "required": [
                  "module"
                ]
              },
              {
                "required": [
                  "field"
                ]
              }
            ]
          }
        }
      ],
      "properties": {
        "global": {
          "type": "string",
          "pattern": "^[a-z][a-z0-9_]*$"
        },
        "module": {
          "type": "string",
          "minLength": 1
        },
        "field": {
          "type": "string",
          "pattern": "^[a-z_][a-z0-9_]*$"
        },
        "label": {
          "description": "what to ask (annotations.json: from GlobalConfig's field name unless the source names it); a pick's heading",
          "type": "string",
          "minLength": 1
        },
        "kind": {
          "description": "text (default), number, bool, or recording (a picker of dimos recordings)",
          "enum": [
            "text",
            "number",
            "bool",
            "recording"
          ]
        },
        "placeholder": {
          "type": "string"
        },
        "docs": {
          "description": "A page on how to find this value (where a robot's IP comes from); the Launcher links it beside the field. experimental/gateway/test_robots.py checks it resolves.",
          "type": "string",
          "pattern": "^https://"
        },
        "default": {
          "description": "what to suggest: a value, or for a pick the label of the choice to start on (else its first)"
        },
        "choices": {
          "description": "the options (an enum), each with a label: for a config value, each a `value` it can take; for a pick, each a `set` of config values (GlobalConfig field or <module>.<field> to its value) it applies together. Without `choices`: a free value.",
          "type": "array",
          "minItems": 2,
          "items": {
            "type": "object",
            "additionalProperties": false,
            "required": [
              "label"
            ],
            "oneOf": [
              {
                "required": [
                  "value"
                ],
                "not": {
                  "required": [
                    "set"
                  ]
                }
              },
              {
                "required": [
                  "set"
                ],
                "not": {
                  "required": [
                    "value"
                  ]
                }
              }
            ],
            "properties": {
              "value": {},
              "label": {
                "type": "string",
                "minLength": 1
              },
              "set": {
                "type": "object",
                "minProperties": 1,
                "propertyNames": {
                  "pattern": "^[a-z_][a-z0-9_]*(\\.[a-z_][a-z0-9_]*)?$|^[A-Za-z][A-Za-z0-9_]*\\.[a-z_][a-z0-9_]*$"
                }
              }
            }
          }
        },
        "when": {
          "description": "show it only while these config values (GlobalConfig field or <module>.<field>, as some other entry sets them) are these, e.g. {\"replay\": true} for a recording picker",
          "type": "object",
          "minProperties": 1
        },
        "required": {
          "type": "boolean",
          "description": "it won't run without it (while it is shown)"
        },
        "streams": {
          "description": "recording: the streams it must have, each a list of acceptable names",
          "type": "array",
          "items": {
            "type": "array",
            "minItems": 1,
            "items": {
              "type": "string"
            }
          }
        },
        "type": {
          "description": "generated: the GlobalConfig field's type",
          "enum": [
            "string",
            "boolean",
            "integer",
            "number",
            "json"
          ]
        },
        "nullable": {
          "description": "generated: the GlobalConfig field takes null",
          "type": "boolean"
        },
        "description": {
          "description": "generated: the GlobalConfig field's description",
          "type": "string"
        }
      }
    }
  }
}
