{
  "$schema": "./annotations.schema.json",
  "about": "Generated from annotations.yaml by `python -m experimental.gateway.utils.robots --write` (don't edit it; edit annotations.yaml): every robot dimos supports and its blueprints, and the settings to decide before running each, with each GlobalConfig setting's type, default and choices read from GlobalConfig. Served by the dimos gateway at GET /dimos/robots; read per tag through dimos.yaml's `robots:`.",
  "types": {
    "dog": {
      "label": "Dogs"
    },
    "humanoid": {
      "label": "Humanoids"
    },
    "wheeled": {
      "label": "Wheeled bases"
    },
    "arm": {
      "label": "Arms"
    },
    "drone": {
      "label": "Drones"
    }
  },
  "robots": {
    "go2": {
      "name": "Unitree Go2",
      "description": "Unitree's quadruped: camera, lidar, WebRTC, DDS or a zenoh bridge.",
      "type": "dog",
      "manufacturer": "Unitree",
      "dirs": [
        "dimos/robot/unitree/go2"
      ],
      "recommended": [
        "unitree-go2",
        "unitree-go2-agentic",
        "unitree-go2-basic",
        "teleop-phone-go2"
      ],
      "defaults": {
        "recommended_config": [
          {
            "label": "Run it on",
            "choices": [
              {
                "label": "Robot",
                "set": {
                  "replay": false,
                  "simulation": ""
                }
              },
              {
                "label": "Replay",
                "set": {
                  "replay": true,
                  "simulation": ""
                }
              },
              {
                "label": "Simulator",
                "set": {
                  "replay": false,
                  "simulation": "mujoco"
                }
              }
            ]
          },
          {
            "global": "robot_ip",
            "label": "Robot IP",
            "type": "string",
            "nullable": true,
            "default": null,
            "kind": "text",
            "placeholder": "192.168.12.1",
            "required": true,
            "docs": "https://docs.dimensional.org/platforms/quadruped/go2/setup/#first-time-setup-connecting-to-wifi-finding-robot-ip",
            "when": {
              "replay": false,
              "simulation": ""
            }
          },
          {
            "global": "replay_db",
            "label": "Recording",
            "type": "string",
            "nullable": false,
            "default": "go2_short",
            "kind": "recording",
            "streams": [
              [
                "go2_lidar",
                "lidar"
              ],
              [
                "go2_odom",
                "odom"
              ],
              [
                "color_image"
              ]
            ],
            "when": {
              "replay": true,
              "simulation": ""
            }
          }
        ]
      },
      "blueprints": {
        "unitree-go2-basic": {
          "title": "Go2 basic",
          "description": "Connects to a Go2 and streams its camera, lidar and pose. The simplest way to get a Go2 going: drive it from Controller.",
          "starter": 1
        },
        "unitree-go2": {
          "title": "Go2 with map + navigation",
          "description": "Builds a 3D map and a costmap as it walks; click a spot to send it there, or let it explore on its own.",
          "starter": 2
        },
        "unitree-go2-agentic": {
          "title": "Go2 with an agent",
          "description": "Map and navigation plus an AI agent you can talk to (over MCP), with a memory of what it has seen.",
          "starter": 3,
          "recommended_config": [
            {
              "label": "Run it on",
              "choices": [
                {
                  "label": "Robot",
                  "set": {
                    "replay": false,
                    "simulation": ""
                  }
                },
                {
                  "label": "Replay",
                  "set": {
                    "replay": true,
                    "simulation": ""
                  }
                },
                {
                  "label": "Simulator",
                  "set": {
                    "replay": false,
                    "simulation": "mujoco"
                  }
                }
              ]
            },
            {
              "global": "robot_ip",
              "label": "Robot IP",
              "type": "string",
              "nullable": true,
              "default": null,
              "kind": "text",
              "placeholder": "192.168.12.1",
              "required": true,
              "docs": "https://docs.dimensional.org/platforms/quadruped/go2/setup/#first-time-setup-connecting-to-wifi-finding-robot-ip",
              "when": {
                "replay": false,
                "simulation": ""
              }
            },
            {
              "global": "replay_db",
              "label": "Recording",
              "type": "string",
              "nullable": false,
              "default": "go2_short",
              "kind": "recording",
              "streams": [
                [
                  "go2_lidar",
                  "lidar"
                ],
                [
                  "go2_odom",
                  "odom"
                ],
                [
                  "color_image"
                ]
              ],
              "when": {
                "replay": true,
                "simulation": ""
              }
            },
            {
              "global": "detection_model",
              "label": "Detection model",
              "type": "string",
              "nullable": false,
              "default": "moondream",
              "kind": "text",
              "choices": [
                {
                  "value": "qwen",
                  "label": "qwen"
                },
                {
                  "value": "moondream",
                  "label": "moondream"
                }
              ]
            }
          ]
        },
        "unitree-go2-webrtc-keyboard-teleop": {
          "title": "Go2 keyboard driving",
          "description": "Drive a Go2 with this computer's keyboard, over WebRTC."
        },
        "unitree-go2-detection": {
          "title": "Go2 with 3D detection",
          "description": "Map and navigation plus 3D object detection on its camera.",
          "starter": 5
        },
        "teleop-phone-go2": {
          "title": "Go2 phone driving",
          "description": "Drive a Go2 from a phone's touch controls.",
          "starter": 6,
          "recommended_config": [
            {
              "global": "robot_ip",
              "label": "Robot IP",
              "type": "string",
              "nullable": true,
              "default": null,
              "kind": "text",
              "placeholder": "192.168.12.1",
              "required": true,
              "docs": "https://docs.dimensional.org/platforms/quadruped/go2/setup/#first-time-setup-connecting-to-wifi-finding-robot-ip"
            }
          ]
        },
        "unitree-go2-agentic-cockpit": {
          "title": "Go2 agent with a cockpit",
          "description": "The Go2 agent with an authored cockpit: video over the 3D voxel map."
        },
        "unitree-go2-agentic-huggingface": {
          "title": "Go2 agent (Hugging Face model)",
          "description": "The Go2 agent with its language model served from Hugging Face."
        },
        "unitree-go2-agentic-ollama": {
          "title": "Go2 agent (Ollama model)",
          "description": "The Go2 agent with a local language model served by Ollama."
        },
        "unitree-go2-cockpit": {
          "title": "Go2 with a cockpit",
          "description": "Map and navigation with an authored cockpit: video over the 3D voxel map."
        },
        "unitree-go2-coordinator": {
          "title": "Go2 control coordinator",
          "description": "A Go2 behind dimos's ControlCoordinator (the base for controller experiments).",
          "recommended_config": [
            {
              "global": "robot_ip",
              "label": "Robot IP",
              "type": "string",
              "nullable": true,
              "default": null,
              "kind": "text",
              "placeholder": "192.168.12.1",
              "required": true,
              "docs": "https://docs.dimensional.org/platforms/quadruped/go2/setup/#first-time-setup-connecting-to-wifi-finding-robot-ip"
            }
          ]
        },
        "unitree-go2-fleet": {
          "title": "Go2 fleet",
          "description": "Several Go2s driven together: every command goes to all of them.",
          "recommended_config": [
            {
              "global": "robot_ips",
              "label": "Robot IPs",
              "type": "string",
              "nullable": true,
              "default": null,
              "kind": "text",
              "placeholder": "192.168.12.1,192.168.12.2",
              "required": true,
              "docs": "https://docs.dimensional.org/platforms/quadruped/go2/setup/#first-time-setup-connecting-to-wifi-finding-robot-ip"
            },
            {
              "global": "robot_ip",
              "label": "Robot IP",
              "type": "string",
              "nullable": true,
              "default": null,
              "kind": "text",
              "placeholder": "192.168.12.1",
              "required": true,
              "docs": "https://docs.dimensional.org/platforms/quadruped/go2/setup/#first-time-setup-connecting-to-wifi-finding-robot-ip"
            }
          ]
        },
        "unitree-go2-holonomic-benchmark": {
          "title": "Go2 holonomic benchmark",
          "description": "Benchmarks the holonomic full-pose controller on a Go2.",
          "hidden": true,
          "recommended_config": [
            {